{
  "$schema": "https://json-schema.org/draft/2020-12/schema",
  "$id": "urn:research-loom:projects:project-config:0.1.0",
  "title": "research-loom canonical Project Config",
  "description": "Project-local declarative configuration. It seeds and references research work, requests Profiles, preserves Research Attention, and carries project-local guards without becoming authoritative Research State or a reusable Profile.",
  "type": "object",
  "additionalProperties": false,
  "required": [
    "schema_version",
    "config_version",
    "project",
    "scope",
    "research_questions",
    "profile_requests",
    "communication_brief",
    "research_attention",
    "project_constraints",
    "resource_references",
    "capability_hints",
    "provenance",
    "configuration_digest"
  ],
  "properties": {
    "schema_version": {
      "const": "0.1.0"
    },
    "config_version": {
      "$ref": "#/$defs/semver"
    },
    "project": {
      "$ref": "#/$defs/project_identity"
    },
    "scope": {
      "$ref": "#/$defs/project_scope"
    },
    "research_questions": {
      "$ref": "#/$defs/research_questions"
    },
    "profile_requests": {
      "$ref": "#/$defs/profile_requests"
    },
    "communication_brief": {
      "$ref": "#/$defs/communication_brief"
    },
    "research_attention": {
      "type": "array",
      "items": {
        "$ref": "#/$defs/attention_item"
      }
    },
    "project_constraints": {
      "$ref": "#/$defs/project_constraints"
    },
    "resource_references": {
      "type": "array",
      "items": {
        "$ref": "#/$defs/resource_reference"
      }
    },
    "capability_hints": {
      "type": "array",
      "items": {
        "$ref": "#/$defs/capability_hint"
      }
    },
    "provenance": {
      "$ref": "#/$defs/provenance"
    },
    "publication_metadata": {
      "type": "object",
      "additionalProperties": false,
      "properties": {
        "research_group_type": {
          "anyOf": [
            {
              "enum": [
                "G",
                "M",
                null
              ]
            },
            {
              "type": "string",
              "pattern": "^\\s*$"
            }
          ]
        }
      }
    },
    "configuration_digest": {
      "$ref": "#/$defs/digest"
    }
  },
  "$defs": {
    "identifier": {
      "type": "string",
      "pattern": "^[A-Za-z0-9][A-Za-z0-9._-]{0,127}$"
    },
    "profile_id": {
      "type": "string",
      "pattern": "^[a-z0-9][a-z0-9._-]{0,127}$"
    },
    "semver": {
      "type": "string",
      "pattern": "^(0|[1-9][0-9]*)\\.(0|[1-9][0-9]*)\\.(0|[1-9][0-9]*)$"
    },
    "version_range": {
      "type": "string",
      "description": "Exact SemVer or a whitespace-separated conjunction of simple SemVer comparators; identical to the Profile request grammar from PR 4.",
      "pattern": "^(?:(?:0|[1-9][0-9]*)\\.(?:0|[1-9][0-9]*)\\.(?:0|[1-9][0-9]*)|(?:(?:>=|>|<=|<|=)(?:0|[1-9][0-9]*)\\.(?:0|[1-9][0-9]*)\\.(?:0|[1-9][0-9]*))(?:\\s+(?:(?:>=|>|<=|<|=)(?:0|[1-9][0-9]*)\\.(?:0|[1-9][0-9]*)\\.(?:0|[1-9][0-9]*)))*)$"
    },
    "digest": {
      "type": "string",
      "pattern": "^sha256:[0-9a-f]{64}$"
    },
    "project_identity": {
      "type": "object",
      "additionalProperties": false,
      "required": [
        "project_id",
        "title",
        "objective"
      ],
      "properties": {
        "project_id": {
          "$ref": "#/$defs/identifier"
        },
        "title": {
          "type": "string",
          "minLength": 1
        },
        "objective": {
          "type": "string",
          "minLength": 1
        }
      }
    },
    "project_scope": {
      "type": "object",
      "additionalProperties": false,
      "required": [
        "in_scope",
        "out_of_scope"
      ],
      "properties": {
        "in_scope": {
          "type": "array",
          "minItems": 1,
          "uniqueItems": true,
          "items": {
            "type": "string",
            "minLength": 1
          }
        },
        "out_of_scope": {
          "type": "array",
          "uniqueItems": true,
          "items": {
            "type": "string",
            "minLength": 1
          }
        }
      }
    },
    "research_question_reference": {
      "type": "object",
      "additionalProperties": false,
      "required": [
        "question_id"
      ],
      "properties": {
        "question_id": {
          "$ref": "#/$defs/identifier"
        }
      }
    },
    "research_question_seed": {
      "type": "object",
      "additionalProperties": false,
      "required": [
        "seed_id",
        "text"
      ],
      "properties": {
        "seed_id": {
          "$ref": "#/$defs/identifier"
        },
        "text": {
          "type": "string",
          "minLength": 1
        },
        "rationale": {
          "type": "string"
        },
        "parent_seed_id": {
          "$ref": "#/$defs/identifier"
        }
      }
    },
    "research_questions": {
      "type": "object",
      "additionalProperties": false,
      "required": [
        "references",
        "seeds"
      ],
      "properties": {
        "references": {
          "type": "array",
          "items": {
            "$ref": "#/$defs/research_question_reference"
          }
        },
        "seeds": {
          "type": "array",
          "items": {
            "$ref": "#/$defs/research_question_seed"
          }
        }
      },
      "anyOf": [
        {
          "properties": {
            "references": {
              "minItems": 1
            }
          }
        },
        {
          "properties": {
            "seeds": {
              "minItems": 1
            }
          }
        }
      ]
    },
    "profile_requirement": {
      "type": "object",
      "additionalProperties": false,
      "required": [
        "profile_id",
        "profile_type",
        "version"
      ],
      "properties": {
        "profile_id": {
          "$ref": "#/$defs/profile_id"
        },
        "profile_type": {
          "enum": [
            "research",
            "organization",
            "narrative",
            "publication"
          ]
        },
        "version": {
          "$ref": "#/$defs/version_range"
        }
      }
    },
    "research_profile_requirement": {
      "allOf": [
        {
          "$ref": "#/$defs/profile_requirement"
        },
        {
          "properties": {
            "profile_type": {
              "const": "research"
            }
          }
        }
      ]
    },
    "organization_profile_requirement": {
      "allOf": [
        {
          "$ref": "#/$defs/profile_requirement"
        },
        {
          "properties": {
            "profile_type": {
              "const": "organization"
            }
          }
        }
      ]
    },
    "narrative_profile_requirement": {
      "allOf": [
        {
          "$ref": "#/$defs/profile_requirement"
        },
        {
          "properties": {
            "profile_type": {
              "const": "narrative"
            }
          }
        }
      ]
    },
    "publication_profile_requirement": {
      "allOf": [
        {
          "$ref": "#/$defs/profile_requirement"
        },
        {
          "properties": {
            "profile_type": {
              "const": "publication"
            }
          }
        }
      ]
    },
    "profile_requests": {
      "type": "object",
      "additionalProperties": false,
      "required": [
        "research",
        "organization",
        "narrative",
        "publication"
      ],
      "properties": {
        "research": {
          "type": "array",
          "items": {
            "$ref": "#/$defs/research_profile_requirement"
          }
        },
        "organization": {
          "type": "array",
          "items": {
            "$ref": "#/$defs/organization_profile_requirement"
          }
        },
        "narrative": {
          "type": "array",
          "items": {
            "$ref": "#/$defs/narrative_profile_requirement"
          }
        },
        "publication": {
          "type": "array",
          "items": {
            "$ref": "#/$defs/publication_profile_requirement"
          }
        }
      },
      "anyOf": [
        {
          "properties": {
            "research": {
              "minItems": 1
            }
          }
        },
        {
          "properties": {
            "organization": {
              "minItems": 1
            }
          }
        },
        {
          "properties": {
            "narrative": {
              "minItems": 1
            }
          }
        },
        {
          "properties": {
            "publication": {
              "minItems": 1
            }
          }
        }
      ]
    },
    "communication_brief": {
      "type": "object",
      "additionalProperties": false,
      "required": [
        "audience",
        "core_message"
      ],
      "properties": {
        "audience": {
          "type": "array",
          "minItems": 1,
          "uniqueItems": true,
          "items": {
            "type": "string",
            "minLength": 1
          }
        },
        "purpose": {
          "type": "string",
          "minLength": 1
        },
        "desired_decision": {
          "type": "string",
          "minLength": 1
        },
        "core_message": {
          "type": "string",
          "minLength": 1
        },
        "must_include": {
          "type": "array",
          "uniqueItems": true,
          "items": {
            "type": "string",
            "minLength": 1
          }
        },
        "tone": {
          "type": "string",
          "minLength": 1
        }
      },
      "description": "Project-local audience/purpose/message intent. Project-specific prohibited claims are canonicalized under project_constraints.must_not_claim rather than duplicated here."
    },
    "projection_hint": {
      "type": "object",
      "additionalProperties": false,
      "required": [
        "hint_type",
        "value",
        "normative"
      ],
      "properties": {
        "hint_type": {
          "enum": [
            "provisional_outline",
            "publication_location",
            "primary_exposition_location",
            "literal_heading",
            "chapter_number"
          ]
        },
        "value": {
          "type": "string",
          "minLength": 1
        },
        "normative": {
          "const": false
        }
      }
    },
    "attention_item": {
      "type": "object",
      "additionalProperties": false,
      "required": [
        "attention_id",
        "statement",
        "disposition"
      ],
      "properties": {
        "attention_id": {
          "$ref": "#/$defs/identifier"
        },
        "statement": {
          "type": "string",
          "minLength": 1
        },
        "rationale": {
          "type": "string"
        },
        "source_reference_ids": {
          "type": "array",
          "uniqueItems": true,
          "items": {
            "$ref": "#/$defs/identifier"
          }
        },
        "related_question_ids": {
          "type": "array",
          "uniqueItems": true,
          "items": {
            "$ref": "#/$defs/identifier"
          }
        },
        "related_question_seed_ids": {
          "type": "array",
          "uniqueItems": true,
          "items": {
            "$ref": "#/$defs/identifier"
          }
        },
        "disposition": {
          "enum": [
            "active",
            "dropped",
            "out_of_scope"
          ]
        },
        "disposition_reason": {
          "type": "string",
          "minLength": 1
        },
        "projection_hints": {
          "type": "array",
          "items": {
            "$ref": "#/$defs/projection_hint"
          }
        }
      },
      "allOf": [
        {
          "if": {
            "properties": {
              "disposition": {
                "enum": [
                  "dropped",
                  "out_of_scope"
                ]
              }
            },
            "required": [
              "disposition"
            ]
          },
          "then": {
            "required": [
              "disposition_reason"
            ]
          }
        }
      ]
    },
    "guard": {
      "type": "object",
      "additionalProperties": false,
      "required": [
        "guard_id",
        "statement"
      ],
      "properties": {
        "guard_id": {
          "$ref": "#/$defs/identifier"
        },
        "statement": {
          "type": "string",
          "minLength": 1
        },
        "rationale": {
          "type": "string"
        }
      }
    },
    "project_constraints": {
      "type": "object",
      "additionalProperties": false,
      "required": [
        "requirements",
        "prohibitions",
        "must_not_claim"
      ],
      "properties": {
        "requirements": {
          "type": "array",
          "items": {
            "$ref": "#/$defs/guard"
          }
        },
        "prohibitions": {
          "type": "array",
          "items": {
            "$ref": "#/$defs/guard"
          }
        },
        "must_not_claim": {
          "type": "array",
          "items": {
            "$ref": "#/$defs/guard"
          }
        }
      },
      "description": "Project-local guards applied in addition to Core and resolved Profile semantics. They are not Profile constraints, carry no merge strategy, and grant no weakening or precedence."
    },
    "resource_reference": {
      "type": "object",
      "additionalProperties": false,
      "required": [
        "reference_id",
        "reference_type"
      ],
      "properties": {
        "reference_id": {
          "$ref": "#/$defs/identifier"
        },
        "reference_type": {
          "enum": [
            "input",
            "source",
            "artifact"
          ]
        },
        "object_id": {
          "$ref": "#/$defs/identifier"
        },
        "locator": {
          "type": "string",
          "minLength": 1
        },
        "digest": {
          "$ref": "#/$defs/digest"
        },
        "purpose": {
          "type": "string",
          "minLength": 1
        }
      },
      "anyOf": [
        {
          "required": [
            "object_id"
          ]
        },
        {
          "required": [
            "locator"
          ]
        }
      ],
      "description": "Reference to a project input or an existing/planned Core Source or Artifact. A reference is not itself Evidence and does not grant runtime access."
    },
    "capability_hint": {
      "type": "object",
      "additionalProperties": false,
      "required": [
        "capability_id",
        "availability_hint",
        "permission_hint"
      ],
      "properties": {
        "capability_id": {
          "$ref": "#/$defs/identifier"
        },
        "availability_hint": {
          "enum": [
            "available",
            "unavailable",
            "conditional",
            "unknown"
          ]
        },
        "permission_hint": {
          "enum": [
            "unspecified",
            "no_project_objection",
            "human_approval_required",
            "project_prohibited"
          ]
        },
        "rationale": {
          "type": "string"
        }
      },
      "description": "Non-authoritative project hints only. Availability does not select a Research Method; permission_hint records project posture and is not runtime authorization."
    },
    "provenance": {
      "type": "object",
      "additionalProperties": false,
      "required": [
        "source_reference_ids",
        "derived_from_configuration_digests"
      ],
      "properties": {
        "source_reference_ids": {
          "type": "array",
          "uniqueItems": true,
          "items": {
            "$ref": "#/$defs/identifier"
          }
        },
        "derived_from_configuration_digests": {
          "type": "array",
          "uniqueItems": true,
          "items": {
            "$ref": "#/$defs/digest"
          }
        },
        "notes": {
          "type": "array",
          "items": {
            "type": "string",
            "minLength": 1
          }
        }
      }
    }
  }
}
